{
  "event_id": "evt_0001",
  "trace_id": "tr_audit_0001",
  "tenant_id": "tenant-a",
  "event_type": "http_request",
  "method": "POST",
  "path": "/claims/extract",
  "status_code": 200,
  "outcome": "success",
  "metadata": {
    "duration_ms": 10.5
  },
  "created_at": "2026-07-07T00:00:00Z"
}

